{
  "brand_text": "Keychron",
  "description_text": "Product details\n\nKeychron K8 Pro QMK Wireless Mechanical Keyboard allows anyone to master any keyboard keys or macro commands through Keychron Launcher web app, it has included keycaps for both Windows and macOS, and users can hotswap with any MX mechanical switch in a breeze (hot-swappable version only).\n\nAnyone can master any keys or macro commands through Keychron Launcher web app on the K8 Pro. Together with our signature features and upgraded typing sound, the K8 Pro is advancing the typing experience to an entirely new level with endless possibilities.\n\n*The Black - Fully Assembled version is NOT hot-swappable and it doesn't include sound-absorbing foam, silicone pad. The stabilizers are mounted on the plate.\n\nMore Accessories For Your K8 Pro\n\nWireless and Wired\n\nAn excellent solution for multitasking. You can connect the K8 Pro with up to 3 devices wirelessly via its stable Broadcom Bluetooth 5.1 for seamless multitasking across your laptop, phone, and tablet. Switch among them swiftly, and it’s fully compatible with both Mac and Windows.\n\nA reliable USB Type-C wired connection is also available when you need it.\n\nProgram with QMK & Launcher.\n\nThe open-source QMK firmware means endless possibilities for key remapping, macros, shortcuts, and more. Now you can easily customize each key with the Keychron Launcher web app.\n\nClick here to use Keychron Launcher\n\n* Please use the latest version of Chrome / Opera / Edge browser to open the Launcher and connect the keyboard to your device via wired mode.\n\nK8 Pro Source code\n\nLearn more about how to use Keychron Launcher >\n\nUpgraded Typing Experience\n\nThe K8 Pro has been re-engineered and redesigned from the inside out to upgrade the typing experience. The added sound-absorbing foam, a thick silicone dampening bottom pad, and steel plate provide responsive feedback and a peaceful typing sound, while added weight will enhance the stability.\n\n**The Black - Fully Assembled version is NOT hot-swappable and it doesn't include sound-absorbing foam, silicone pad. The stabilizers are mounted on the plate.\n\nSuitable For All Devices\n\nOffers a Mac layout while still being compatible with Windows, the K8 Pro is one of the few on the market that has the same multimedia and function key functions as Apple keyboards for Mac users, but with more tactile feedback.\n\nYou can even configure different keymaps for both Mac and Windows devices. While Keychron Launcher web app is compatible with macOS, Windows, and Linux. Includes keycaps for both macOS and Windows (4 keycaps for each) to allow you to switch between operating systems with ease.\n\nCheck high-res keycap layout and size here.\n\nHot-swappable (Optional)\n\nWe also provide a hot-swappable version for your choice, which means you can customize your typing experience without soldering, pop them in and it's done.\nEvery detail matters for a personalized typing experience, that’s why we give you the power. You can hot-swap every switch on the K8 Pro with almost all of the 3pin and 5pin MX style mechanical switches on the market (including Cherry, Gateron, Kailh, Panda, etc.) without soldering. You can customize your own typing experience in seconds.\n\nThe Barebone version (without switch and keycap) is also available at your choice.\n\nScrew-In PCB Stabilizers\n\nEven small part matters for your fingertip feel. We’ve integrated the PCB-mounted screw-in stabilizers for a smoother typing experience with less wobbliness on the big keys such as space bar, shift, enter, and delete. The Keychron K8 Pro also supports third-party screw-in PCB stabilizers.\n\n*Stabilizers of the non-hot-swappable versions are mounted on the plate.\n\nPre-lubed Gateron G Pro Switch\n\nBy optimizing the switch mold, the G Pro switch wobbles less than a standard mechanical switch and feels smoother on each hit. Plus, the factory pre-lubed process on all the G Pro switches (exclude the clicky ones), no doubt this will ensure the best smoothness at your fingertips when typing.\n\nKeychron K Pro Banana switch provides an early tactile bump at the top with a uniquely smooth experience like those Panda switches on the market.\n\nTyping sound test of the K8 Pro with Gateron G Pro switches and OSA profile double-shot PBT keycaps.\n\nOSA Profile Double-shot PBT Keycaps\n\nTo further fine-tune your typing experience, the K8 Pro comes with our unique OSA profile (OEM profile with spherical-angle) and double-shot PBT keycaps that aim to provide a more comfortable fingertip feel with excellent oil resistance for long-term use on the timeless tenkeyless layout.\n\nSouth-facing RGB Lights\n\nThe south-facing RGB is designed to better illuminate the keyboard backlight from the typist’s angle. The south-facing RGB is also free from interference when the user installs Cherry-profile alternative keycaps on their keyboard.\n\nComes with more than 22 types of RGB backlight settings as well as a static white backlight option. You can further fine-tune the RGB hue, saturation, brightness, effect speed with ease.\n\nErgonomic Support\n\nThree levels of adjustable typing angle (3.5º, 7.5º & 10.5º) and curved OSA-profile keycaps are all working together to provide long-lasting ergonomic support for your wrist.\n\nLooking for ISO Layout?\n\nThe K8 Pro ISO collection comes with fully assembled keyboards with 🇬🇧UK, 🇩🇪German, 🇩🇰🇫🇮🇳🇴🇸🇪Nordic, 🇨🇭Swiss, 🇫🇷French, and 🇪🇸 Spanish layout.\n\nCheck The K8 Pro ISO Layout Collection\n\nWhat's in the box?",
  "failure_reason": null,
  "page_ok": true,
  "page_title": "Keychron K8 Pro QMK/VIA Wireless Mechanical Keyboard",
  "price_text": "Sale price\n$74.99 \nRegular price\n$99.99",
  "product_name": "Keychron K8 Pro QMK/VIA Wireless Mechanical Keyboard",
  "review_count_on_page": 48,
  "reviews": [
    {
      "body": "Very good keyboard i like it so much rgb good the keycaps high quality i suggest to everyone and prices good",
      "rating": 5,
      "written_at": "2026-03-25"
    },
    {
      "body": "Picked up at a Microcenter as an upgrade for my Logitech G series I had for years. From what I had the K8 Pro was a HUGE upgrade, however, I had issues with consistency on the bluetooth connection. I ended up switching to a wired approach. I had the board from Feb-December without any issues, I suddenly had issues with the esc row not working. Support asked a few questions but during the ticket process I realized I had a warranty with the store and returned it there for convenience, however I 100% believe within one year and the issue I had Keychron would have resolved the issue with a replacement. I ended up replacing my K8 with a V1 Max and enjoy it as well.",
      "rating": 4,
      "written_at": "2024-12-06"
    },
    {
      "body": "Words cannot describe how stoked I am about this keyboard. It wasn't originally my first pick, but I am SO glad the other option I had in mind didn't work out because I don't even want to imagine not owning this keyboard. The weight is great, the quality, the feel, the sound, the lights.. EVERYTHING has exceeded my expectations. My original plan was to change the switches and keycaps, but I am so in love that I don't even want to think about swapping them. The only single fault I can find is a small, pink smudge on one of the Windows keycaps (which isn't a big deal to me, I think I can maybe clean it off).\n\nThinking about ordering another K8 Pro for work. Beyond happy with my purchase. Shipping was very quick and very secure, too!",
      "rating": 5,
      "written_at": "2024-07-30"
    }
  ],
  "spec_text": "Specifications\nLayout: 80% TKL, ANSI\nConnectivity: Bluetooth (up to 3 devices); 1000 Hz polling rate\nSwitches: Gateron G Pro Red / Blue / Brown and 3 more; hot-swappable\nBuild: ABS / ABS+Aluminum frame, tray mount\nKeycaps: Double-shot PBT\nBattery: 4000 mAh\nSoftware: QMK firmware; Keychron Launcher web app for key remapping and macros; works with macOS, Windows, Linux\nBacklight: 22 types of RGB backlight options plus endless possibilities\nWeight: About 990 g / 2.2 lbs\nDimensions: 355 x 123 mm (13.9 x 4.84 inches)\nN-key rollover: Yes for both wireless and wired modes\n\nSPECIFICATION\n\nNumber of Keys: 87 (Tenkeyless)\nSwitches  (Not including Barebone Version):\nGateron G Pro Mechanical (Hot-swappable versison)\nKeychron K Pro Mechanical (Non-hot-swappable version)\nSwitch Face: South-facing RGB\nStabilizers:\nPCB-mounted screw-in stabilizers (Hot-swappable version)\nPlate-mounted stabilizers (Non-hot-swappable version)\nNumber of Multimedia Keys: 12 \nFrame Material: ABS / ABS+Aluminum frame\nKeycap Material (Not including Barebone Version): Double-shot PBT\nKeycap Profile: OSA (OEM profile with spherical-angle)\nLayout: ANSI\nPolling Rate (Wired Mode): 1000Hz\nPolling Rate (Wireless Mode): 90Hz\nN-Key Rollover (NKRO): Yes for both wireless and wired modes\n\nCONNECTIVITY AND POWER\n\nBacklit: 22 types of RGB backlight options plus endless possibilities\nBattery: 4000 mAh Rechargeable li-polymer battery\nBT Working Time (Backlit off): Around 260 hours (Lab test result may vary by actual use)\nBT Working Time (RGB): Around 130 hours (Lowest brightness)\nConnection: Bluetooth and Type-C cable\nBluetooth version: 5.1\nBluetooth Device Name: Keychron K8 Pro\nCompatible System: macOS/Windows/Linux\n\nPHYSICAL UNIT\n\nDimension (Plastic frame version): 355 x 123 mm (13.9 x 4.84 inches)\nWeight: About 990 g / 2.2 lbs\nDimension (Aluminum frame version): 359 x 127 mm (14.1 x 5 inches)\nWeight: 1146 g / 2.5 lbs\nHeight incl. keycap (front) 35 mm (1.37 inches)\nHeight incl. keycap (rear) 42 mm (1.65 inches)\nTyping Angle: 3.5º, 7.5º and 10.5º\nMCU: Ultra-low-power ARM Cortex-M4 32-bit STM32L432 (128KB Flash)\nOperating Environment: -10 to 50℃"
}